{
  "schema_version": "atomic-tag-library.v1",
  "library_version": "atomic-tag-library.v1.43",
  "created_at": "2026-10-11T12:00:00.000Z",
  "research_only": true,
  "production_migration": false,
  "philosophy": {
    "tag_is": "a semantically atomic, reusable retrieval component",
    "tag_is_not": "a miniature literary analysis or quote-specific summary",
    "recall_over_precision": true,
    "empty_tags_acceptable": true,
    "fourier_analogy": "PRODUCT/CONCEPTUAL only: a Quote can be decomposed into reusable semantic basis components (Tags), possibly with different relevance strengths. PGWhite does NOT use Fourier Transform, FFT, frequency-domain processing, or DSP."
  },
  "dimensions": {
    "active": [
      "theme",
      "device"
    ],
    "inactive": [
      "scene_time",
      "character"
    ],
    "notes": "Broad Theme 时间 is active and distinct from scene/time metadata; Device remains a separate tagging dimension."
  },
  "counts": {
    "themes_total": 185,
    "themes_active_candidate": 185,
    "themes_excluded_or_other": 0,
    "devices_total": 31,
    "raw_theme_rows": 451,
    "raw_theme_unique_labels": 408,
    "raw_device_rows": 77,
    "cleanup_decisions": 73
  },
  "provenance_counts_themes": {
    "generated_candidate": 162,
    "annotation_benchmark": 42,
    "literary_theme_ontology": 83,
    "existing_pgwhite": 10,
    "legacy_human": 10,
    "manual": 18
  },
  "category_distribution_themes": {
    "世界": 3,
    "人生阶段": 4,
    "关系": 7,
    "关系角色": 2,
    "品格": 5,
    "存在": 30,
    "心智": 12,
    "情感": 32,
    "情感与关系": 11,
    "文化": 10,
    "社会": 27,
    "社会自我": 2,
    "空间情感": 6,
    "空间社会": 1,
    "自我": 4,
    "认知": 8,
    "身心": 7,
    "道德": 3,
    "道德宗教": 3,
    "道德社会": 4,
    "审美": 3,
    "宗教": 1
  },
  "themes": [
    {
      "id": "theme-0004-废墟",
      "canonical_zh": "废墟",
      "label_en": "Ruin",
      "dimension": "theme",
      "definition": "毁坏后的残存空间与历史痕迹。",
      "aliases": [
        "残骸"
      ],
      "related": [
        "衰败",
        "战争",
        "记忆"
      ],
      "parents": [
        "世界"
      ],
      "category": "世界",
      "provenance": [
        "generated_candidate"
      ],
      "source_refs": [],
      "status": "active_candidate",
      "notes": "",
      "representations": {
        "A_label": "废墟",
        "B_label_definition": "废墟：毁坏后的残存空间与历史痕迹。",
        "C_label_definition_aliases": "废墟：毁坏后的残存空间与历史痕迹。｜别名：残骸"
      }
    },
    {
      "id": "theme-0007-灾难",
      "canonical_zh": "灾难",
      "label_en": "Disaster",
      "dimension": "theme",
      "definition": "突发的大规模破坏与危机。",
      "aliases": [
        "灾祸"
      ],
      "related": [
        "末日",
        "恐惧",
        "死亡"
      ],
      "parents": [
        "世界"
      ],
      "category": "世界",
      "provenance": [
        "annotation_benchmark",
        "generated_candidate"
      ],
      "source_refs": [],
      "status": "active_candidate",
      "notes": "",
      "representations": {
        "A_label": "灾难",
        "B_label_definition": "灾难：突发的大规模破坏与危机。",
        "C_label_definition_aliases": "灾难：突发的大规模破坏与危机。｜别名：灾祸"
      }
    },
    {
      "id": "theme-0008-自然",
      "canonical_zh": "自然",
      "label_en": "Nature",
      "dimension": "theme",
      "definition": "自然界及其与人的关系。",
      "aliases": [
        "大自然"
      ],
      "related": [
        "衰败",
        "家园",
        "生命",
        "敬畏"
      ],
      "parents": [
        "世界"
      ],
      "category": "世界",
      "provenance": [
        "generated_candidate",
        "literary_theme_ontology"
      ],
      "source_refs": [
        "lto:theme:human vs. nature",
        "lto:theme:pleasure in nature"
      ],
      "status": "active_candidate",
      "notes": "",
      "representations": {
        "A_label": "自然",
        "B_label_definition": "自然：自然界及其与人的关系。",
        "C_label_definition_aliases": "自然：自然界及其与人的关系。｜别名：大自然"
      }
    },
    {
      "id": "theme-0009-成长",
      "canonical_zh": "成长",
      "label_en": "Coming of Age",
      "dimension": "theme",
      "definition": "从稚嫩走向成熟的变化与觉醒。",
      "aliases": [
        "成熟"
      ],
      "related": [
        "童年",
        "青春",
        "自我身份",
        "经历"
      ],
      "parents": [
        "人生阶段"
      ],
      "category": "人生阶段",
      "provenance": [
        "generated_candidate"
      ],
      "source_refs": [],
      "status": "active_candidate",
      "notes": "",
      "representations": {
        "A_label": "成长",
        "B_label_definition": "成长：从稚嫩走向成熟的变化与觉醒。",
        "C_label_definition_aliases": "成长：从稚嫩走向成熟的变化与觉醒。｜别名：成熟"
      }
    },
    {
      "id": "theme-0010-童年",
      "canonical_zh": "童年",
      "label_en": "Childhood",
      "dimension": "theme",
      "definition": "儿童时期的经验、感知与回忆。",
      "aliases": [
        "幼年",
        "孩子",
        "子女",
        "小孩"
      ],
      "related": [
        "记忆",
        "成长",
        "纯真",
        "父亲",
        "母亲"
      ],
      "parents": [
        "人生阶段"
      ],
      "category": "人生阶段",
      "provenance": [
        "annotation_benchmark",
        "generated_candidate",
        "literary_theme_ontology"
      ],
      "source_refs": [
        "lto:theme:childhood trauma",
        "lto:theme:human childhood"
      ],
      "status": "active_candidate",
      "notes": "",
      "representations": {
        "A_label": "童年",
        "B_label_definition": "童年：儿童时期的经验、感知与回忆。",
        "C_label_definition_aliases": "童年：儿童时期的经验、感知与回忆。｜别名：子女、孩子、小孩、幼年"
      }
    },
    {
      "id": "theme-0011-衰老",
      "canonical_zh": "衰老",
      "label_en": "Aging",
      "dimension": "theme",
      "definition": "变老、机能衰退与老年处境。",
      "aliases": [
        "变老",
        "老去"
      ],
      "related": [
        "衰败",
        "死亡",
        "记忆"
      ],
      "parents": [
        "人生阶段"
      ],
      "category": "人生阶段",
      "provenance": [
        "generated_candidate",
        "literary_theme_ontology"
      ],
      "source_refs": [
        "lto:theme:coping with aging"
      ],
      "status": "active_candidate",
      "notes": "",
      "representations": {
        "A_label": "衰老",
        "B_label_definition": "衰老：变老、机能衰退与老年处境。",
        "C_label_definition_aliases": "衰老：变老、机能衰退与老年处境。｜别名：变老、老去"
      }
    },
    {
      "id": "theme-0012-青春",
      "canonical_zh": "青春",
      "label_en": "Youth",
      "dimension": "theme",
      "definition": "青年阶段的热情、躁动与形成期。",
      "aliases": [
        "少年"
      ],
      "related": [
        "成长",
        "欲望",
        "反叛"
      ],
      "parents": [
        "人生阶段"
      ],
      "category": "人生阶段",
      "provenance": [
        "generated_candidate",
        "literary_theme_ontology"
      ],
      "source_refs": [
        "lto:theme:reminiscence about one's youth",
        "lto:theme:youth rebellion"
      ],
      "status": "active_candidate",
      "notes": "",
      "representations": {
        "A_label": "青春",
        "B_label_definition": "青春：青年阶段的热情、躁动与形成期。",
        "C_label_definition_aliases": "青春：青年阶段的热情、躁动与形成期。｜别名：少年"
      }
    },
    {
      "id": "theme-0013-亲密",
      "canonical_zh": "亲密",
      "label_en": "Intimacy",
      "dimension": "theme",
      "definition": "深度靠近的情感/身体亲近。",
      "aliases": [
        "亲近"
      ],
      "related": [
        "爱情",
        "脆弱",
        "性"
      ],
      "parents": [
        "关系"
      ],
      "category": "关系",
      "provenance": [
        "generated_candidate"
      ],
      "source_refs": [],
      "status": "active_candidate",
      "notes": "",
      "representations": {
        "A_label": "亲密",
        "B_label_definition": "亲密：深度靠近的情感/身体亲近。",
        "C_label_definition_aliases": "亲密：深度靠近的情感/身体亲近。｜别名：亲近"
      }
    },
    {
      "id": "theme-0014-保护",
      "canonical_zh": "保护",
      "label_en": "Protection",
      "dimension": "theme",
      "definition": "守护他者免受伤害。",
      "aliases": [
        "庇护"
      ],
      "related": [
        "爱情",
        "恐惧",
        "牺牲"
      ],
      "parents": [
        "关系"
      ],
      "category": "关系",
      "provenance": [
        "generated_candidate"
      ],
      "source_refs": [],
      "status": "active_candidate",
      "notes": "",
      "representations": {
        "A_label": "保护",
        "B_label_definition": "保护：守护他者免受伤害。",
        "C_label_definition_aliases": "保护：守护他者免受伤害。｜别名：庇护"
      }
    },
    {
      "id": "theme-0015-倾听",
      "canonical_zh": "倾听",
      "label_en": "Listening",
      "dimension": "theme",
      "definition": "认真听取他者或世界的声音。",
      "aliases": [
        "聆听"
      ],
      "related": [
        "怜悯",
        "语言"
      ],
      "parents": [
        "关系"
      ],
      "category": "关系",
      "provenance": [
        "generated_candidate"
      ],
      "source_refs": [],
      "status": "active_candidate",
      "notes": "",
      "representations": {
        "A_label": "倾听",
        "B_label_definition": "倾听：认真听取他者或世界的声音。",
        "C_label_definition_aliases": "倾听：认真听取他者或世界的声音。｜别名：聆听"
      }
    },
    {
      "id": "theme-0016-抛弃",
      "canonical_zh": "抛弃",
      "label_en": "Abandonment",
      "dimension": "theme",
      "definition": "被离开、被弃置或切断依赖。",
      "aliases": [
        "舍弃",
        "遗弃"
      ],
      "related": [
        "失去",
        "童年",
        "依恋",
        "恐惧"
      ],
      "parents": [
        "关系"
      ],
      "category": "关系",
      "provenance": [
        "generated_candidate",
        "literary_theme_ontology"
      ],
      "source_refs": [
        "lto:theme:abandonment"
      ],
      "status": "active_candidate",
      "notes": "",
      "representations": {
        "A_label": "抛弃",
        "B_label_definition": "抛弃：被离开、被弃置或切断依赖。",
        "C_label_definition_aliases": "抛弃：被离开、被弃置或切断依赖。｜别名：舍弃、遗弃"
      }
    },
    {
      "id": "theme-0018-误解",
      "canonical_zh": "误解",
      "label_en": "Misunderstanding",
      "dimension": "theme",
      "definition": "彼此理解失败或意义错位。",
      "aliases": [
        "误会"
      ],
      "related": [
        "语言",
        "孤独",
        "爱情"
      ],